{
  "schema_version": "starlight.civilization_identity_lock.v1",
  "lock_id": "starlight-civilization-144-identities",
  "status": "immutable_identity_registry",
  "policy": {
    "agent_id": "immutable",
    "profile_slug": "stable; any change requires alias, redirect, and reviewed migration receipt",
    "source_identifier": "provenance key; any rename requires alias and reviewed migration receipt",
    "seat_and_ring_are_identity": false
  },
  "source_identity_set_digest": "sha256:84a9d3e4db05f05edbdf5fd76a3ce3c1f35579f68c4a2492b502196dd3fded9d",
  "counts": {
    "identities": 144
  },
  "identities": [
    {
      "source_identifier": "starlight-concierge.md",
      "agent_id": "operative-concierge",
      "profile_slug": "operative-concierge",
      "cohort": "expansion-94",
      "immutable": true,
      "alias_history": {
        "agent_ids": [],
        "profile_slugs": [],
        "source_identifiers": []
      },
      "redirects": [],
      "migration_history": []
    },
    {
      "source_identifier": "starlight-envoy.md",
      "agent_id": "operative-envoy",
      "profile_slug": "operative-envoy",
      "cohort": "expansion-94",
      "immutable": true,
      "alias_history": {
        "agent_ids": [],
        "profile_slugs": [],
        "source_identifiers": []
      },
      "redirects": [],
      "migration_history": []
    },
    {
      "source_identifier": "starlight-voice-operator.md",
      "agent_id": "operative-voice-operator",
      "profile_slug": "operative-voice-operator",
      "cohort": "expansion-94",
      "immutable": true,
      "alias_history": {
        "agent_ids": [],
        "profile_slugs": [],
        "source_identifiers": []
      },
      "redirects": [],
      "migration_history": []
    },
    {
      "source_identifier": "starlight-genius.md",
      "agent_id": "operative-genius",
      "profile_slug": "operative-genius",
      "cohort": "expansion-94",
      "immutable": true,
      "alias_history": {
        "agent_ids": [],
        "profile_slugs": [],
        "source_identifiers": []
      },
      "redirects": [],
      "migration_history": []
    },
    {
      "source_identifier": "starlight-evaluator.md",
      "agent_id": "vera-decision-verifier",
      "profile_slug": "vera-decision-verifier",
      "cohort": "founding-50",
      "immutable": true,
      "alias_history": {
        "agent_ids": [],
        "profile_slugs": [],
        "source_identifiers": []
      },
      "redirects": [],
      "migration_history": []
    },
    {
      "source_identifier": "starlight-orchestrator.md",
      "agent_id": "ignis-product-conductor",
      "profile_slug": "ignis-product-conductor",
      "cohort": "founding-50",
      "immutable": true,
      "alias_history": {
        "agent_ids": [],
        "profile_slugs": [],
        "source_identifiers": []
      },
      "redirects": [],
      "migration_history": []
    },
    {
      "source_identifier": "starlight-prime.md",
      "agent_id": "astra-sovereign",
      "profile_slug": "astra-sovereign",
      "cohort": "founding-50",
      "immutable": true,
      "alias_history": {
        "agent_ids": [],
        "profile_slugs": [],
        "source_identifiers": []
      },
      "redirects": [],
      "migration_history": []
    },
    {
      "source_identifier": "starlight-architect.md",
      "agent_id": "tess-system-designer",
      "profile_slug": "tess-system-designer",
      "cohort": "founding-50",
      "immutable": true,
      "alias_history": {
        "agent_ids": [],
        "profile_slugs": [],
        "source_identifiers": []
      },
      "redirects": [],
      "migration_history": []
    },
    {
      "source_identifier": "starlight-navigator.md",
      "agent_id": "orion-mission-architect",
      "profile_slug": "orion-mission-architect",
      "cohort": "founding-50",
      "immutable": true,
      "alias_history": {
        "agent_ids": [],
        "profile_slugs": [],
        "source_identifiers": []
      },
      "redirects": [],
      "migration_history": []
    },
    {
      "source_identifier": "starlight-sentinel.md",
      "agent_id": "aegis-trust-conductor",
      "profile_slug": "aegis-trust-conductor",
      "cohort": "founding-50",
      "immutable": true,
      "alias_history": {
        "agent_ids": [],
        "profile_slugs": [],
        "source_identifiers": []
      },
      "redirects": [],
      "migration_history": []
    },
    {
      "source_identifier": "starlight-weaver.md",
      "agent_id": "aria-story-architect",
      "profile_slug": "aria-story-architect",
      "cohort": "founding-50",
      "immutable": true,
      "alias_history": {
        "agent_ids": [],
        "profile_slugs": [],
        "source_identifiers": []
      },
      "redirects": [],
      "migration_history": []
    },
    {
      "source_identifier": "starlight-sage.md",
      "agent_id": "mira-continuity-keeper",
      "profile_slug": "mira-continuity-keeper",
      "cohort": "founding-50",
      "immutable": true,
      "alias_history": {
        "agent_ids": [],
        "profile_slugs": [],
        "source_identifiers": []
      },
      "redirects": [],
      "migration_history": []
    },
    {
      "source_identifier": "starlight-hermes.md",
      "agent_id": "lyra-research-conductor",
      "profile_slug": "lyra-research-conductor",
      "cohort": "founding-50",
      "immutable": true,
      "alias_history": {
        "agent_ids": [],
        "profile_slugs": [],
        "source_identifiers": []
      },
      "redirects": [],
      "migration_history": []
    },
    {
      "source_identifier": "starlight-steward.md",
      "agent_id": "cassian-resource-steward",
      "profile_slug": "cassian-resource-steward",
      "cohort": "founding-50",
      "immutable": true,
      "alias_history": {
        "agent_ids": [],
        "profile_slugs": [],
        "source_identifiers": []
      },
      "redirects": [],
      "migration_history": []
    },
    {
      "source_identifier": "sis-extractor-transcripts.md",
      "agent_id": "operative-extractor-transcripts",
      "profile_slug": "operative-extractor-transcripts",
      "cohort": "expansion-94",
      "immutable": true,
      "alias_history": {
        "agent_ids": [],
        "profile_slugs": [],
        "source_identifiers": []
      },
      "redirects": [],
      "migration_history": []
    },
    {
      "source_identifier": "sis-extractor-vault.md",
      "agent_id": "operative-extractor-vault",
      "profile_slug": "operative-extractor-vault",
      "cohort": "expansion-94",
      "immutable": true,
      "alias_history": {
        "agent_ids": [],
        "profile_slugs": [],
        "source_identifiers": []
      },
      "redirects": [],
      "migration_history": []
    },
    {
      "source_identifier": "sis-extractor-prompts.md",
      "agent_id": "operative-extractor-prompts",
      "profile_slug": "operative-extractor-prompts",
      "cohort": "expansion-94",
      "immutable": true,
      "alias_history": {
        "agent_ids": [],
        "profile_slugs": [],
        "source_identifiers": []
      },
      "redirects": [],
      "migration_history": []
    },
    {
      "source_identifier": "sis-extractor-repos.md",
      "agent_id": "operative-extractor-repos",
      "profile_slug": "operative-extractor-repos",
      "cohort": "expansion-94",
      "immutable": true,
      "alias_history": {
        "agent_ids": [],
        "profile_slugs": [],
        "source_identifiers": []
      },
      "redirects": [],
      "migration_history": []
    },
    {
      "source_identifier": "sis-extractor-external.md",
      "agent_id": "operative-extractor-external",
      "profile_slug": "operative-extractor-external",
      "cohort": "expansion-94",
      "immutable": true,
      "alias_history": {
        "agent_ids": [],
        "profile_slugs": [],
        "source_identifiers": []
      },
      "redirects": [],
      "migration_history": []
    },
    {
      "source_identifier": "starlight-sentinel-daemon.md",
      "agent_id": "sentinel-risk-analyst",
      "profile_slug": "sentinel-risk-analyst",
      "cohort": "founding-50",
      "immutable": true,
      "alias_history": {
        "agent_ids": [],
        "profile_slugs": [],
        "source_identifiers": []
      },
      "redirects": [],
      "migration_history": []
    },
    {
      "source_identifier": "starlight-self-is.md",
      "agent_id": "operative-self-is",
      "profile_slug": "operative-self-is",
      "cohort": "expansion-94",
      "immutable": true,
      "alias_history": {
        "agent_ids": [],
        "profile_slugs": [],
        "source_identifiers": []
      },
      "redirects": [],
      "migration_history": []
    },
    {
      "source_identifier": "starlight-secondbrain.md",
      "agent_id": "operative-secondbrain",
      "profile_slug": "operative-secondbrain",
      "cohort": "expansion-94",
      "immutable": true,
      "alias_history": {
        "agent_ids": [],
        "profile_slugs": [],
        "source_identifiers": []
      },
      "redirects": [],
      "migration_history": []
    },
    {
      "source_identifier": "starlight-brand-is.md",
      "agent_id": "operative-brand-is",
      "profile_slug": "operative-brand-is",
      "cohort": "expansion-94",
      "immutable": true,
      "alias_history": {
        "agent_ids": [],
        "profile_slugs": [],
        "source_identifiers": []
      },
      "redirects": [],
      "migration_history": []
    },
    {
      "source_identifier": "starlight-business-is.md",
      "agent_id": "meridian-venture-conductor",
      "profile_slug": "meridian-venture-conductor",
      "cohort": "founding-50",
      "immutable": true,
      "alias_history": {
        "agent_ids": [],
        "profile_slugs": [],
        "source_identifiers": []
      },
      "redirects": [],
      "migration_history": []
    },
    {
      "source_identifier": "starlight-creator-is.md",